{
 "schema_version": "1.1.0",
 "page_url": "https://demo.easyview.local/traffic/",
 "final_url": "snapshot://traffic",
 "page_title": "市交通运输局 · 出行服务（本地快照）",
 "lang": "zh-CN",
 "source": "fallback",
 "fallback_reason": "requested",
 "extracted_at": "2026-10-02T12:37:06+08:00",
 "stats": {
  "total": 81,
  "visible": 81,
  "by_type": {
   "link": 28,
   "image": 1,
   "nav": 1,
   "heading": 6,
   "form": 2,
   "text": 34,
   "input": 4,
   "select": 1,
   "button": 3,
   "table": 1
  },
  "truncated": false
 },
 "elements": [
  {
   "id": "el_117fd433",
   "type": "link",
   "text": "首页",
   "label": null,
   "aria_label": null,
   "placeholder": null,
   "name": null,
   "value": null,
   "href": "https://demo.easyview.local/",
   "selector": "body > div:nth-of-type(1) > a:nth-of-type(1)",
   "xpath": "/html[1]/body[1]/div[1]/a[1]",
   "visible": true,
   "bbox": {
    "x": 20.0,
    "y": 7.0,
    "width": 24.0,
    "height": 16.0
   },
   "group_id": null,
   "in_form": false,
   "form_id": null,
   "required": null,
   "disabled": false,
   "level": null,
   "options": null,
   "order": 0
  },
  {
   "id": "el_69da5e8e",
   "type": "link",
   "text": "政务公开",
   "label": null,
   "aria_label": null,
   "placeholder": null,
   "name": null,
   "value": null,
   "href": "https://demo.easyview.local/gk",
   "selector": "body > div:nth-of-type(1) > a:nth-of-type(2)",
   "xpath": "/html[1]/body[1]/div[1]/a[2]",
   "visible": true,
   "bbox": {
    "x": 63.0,
    "y": 7.0,
    "width": 48.0,
    "height": 16.0
   },
   "group_id": null,
   "in_form": false,
   "form_id": null,
   "required": null,
   "disabled": false,
   "level": null,
   "options": null,
   "order": 1
  },
  {
   "id": "el_10437bad",
   "type": "link",
   "text": "网上服务",
   "label": null,
   "aria_label": null,
   "placeholder": null,
   "name": null,
   "value": null,
   "href": "https://demo.easyview.local/fw",
   "selector": "body > div:nth-of-type(1) > a:nth-of-type(3)",
   "xpath": "/html[1]/body[1]/div[1]/a[3]",
   "visible": true,
   "bbox": {
    "x": 129.0,
    "y": 7.0,
    "width": 48.0,
    "height": 16.0
   },
   "group_id": null,
   "in_form": false,
   "form_id": null,
   "required": null,
   "disabled": false,
   "level": null,
   "options": null,
   "order": 2
  },
  {
   "id": "el_1ea3c055",
   "type": "link",
   "text": "互动交流",
   "label": null,
   "aria_label": null,
   "placeholder": null,
   "name": null,
   "value": null,
   "href": "https://demo.easyview.local/hd",
   "selector": "body > div:nth-of-type(1) > a:nth-of-type(4)",
   "xpath": "/html[1]/body[1]/div[1]/a[4]",
   "visible": true,
   "bbox": {
    "x": 196.0,
    "y": 7.0,
    "width": 48.0,
    "height": 16.0
   },
   "group_id": null,
   "in_form": false,
   "form_id": null,
   "required": null,
   "disabled": false,
   "level": null,
   "options": null,
   "order": 3
  },
  {
   "id": "el_6ba979ec",
   "type": "link",
   "text": "专题专栏",
   "label": null,
   "aria_label": null,
   "placeholder": null,
   "name": null,
   "value": null,
   "href": "https://demo.easyview.local/zt",
   "selector": "body > div:nth-of-type(1) > a:nth-of-type(5)",
   "xpath": "/html[1]/body[1]/div[1]/a[5]",
   "visible": true,
   "bbox": {
    "x": 262.0,
    "y": 7.0,
    "width": 48.0,
    "height": 16.0
   },
   "group_id": null,
   "in_form": false,
   "form_id": null,
   "required": null,
   "disabled": false,
   "level": null,
   "options": null,
   "order": 4
  },
  {
   "id": "el_978ea7af",
   "type": "image",
   "text": "示例市交通运输局标识",
   "label": null,
   "aria_label": null,
   "placeholder": null,
   "name": null,
   "value": null,
   "href": null,
   "selector": "img",
   "xpath": "/html[1]/body[1]/header[1]/img[1]",
   "visible": true,
   "bbox": {
    "x": 20.0,
    "y": 45.0,
    "width": 52.0,
    "height": 52.0
   },
   "group_id": "grp_594fd161",
   "in_form": false,
   "form_id": null,
   "required": null,
   "disabled": false,
   "level": null,
   "options": null,
   "order": 5
  },
  {
   "id": "el_fea877d4",
   "type": "nav",
   "text": "交通服务导航",
   "label": null,
   "aria_label": "交通服务导航",
   "placeholder": null,
   "name": null,
   "value": null,
   "href": null,
   "selector": "nav",
   "xpath": "/html[1]/body[1]/nav[1]",
   "visible": true,
   "bbox": {
    "x": 0.0,
    "y": 115.0,
    "width": 1366.0,
    "height": 44.0
   },
   "group_id": null,
   "in_form": false,
   "form_id": null,
   "required": null,
   "disabled": false,
   "level": null,
   "options": null,
   "order": 6
  },
  {
   "id": "el_1c7ec156",
   "type": "link",
   "text": "公交查询",
   "label": null,
   "aria_label": null,
   "placeholder": null,
   "name": null,
   "value": null,
   "href": "https://demo.easyview.local/bus",
   "selector": "nav > a:nth-of-type(1)",
   "xpath": "/html[1]/body[1]/nav[1]/a[1]",
   "visible": true,
   "bbox": {
    "x": 20.0,
    "y": 115.0,
    "width": 98.0,
    "height": 44.0
   },
   "group_id": "grp_fea877d4",
   "in_form": false,
   "form_id": null,
   "required": null,
   "disabled": false,
   "level": null,
   "options": null,
   "order": 7
  },
  {
   "id": "el_e64c55d5",
   "type": "link",
   "text": "地铁出行",
   "label": null,
   "aria_label": null,
   "placeholder": null,
   "name": null,
   "value": null,
   "href": "https://demo.easyview.local/metro",
   "selector": "nav > a:nth-of-type(2)",
   "xpath": "/html[1]/body[1]/nav[1]/a[2]",
   "visible": true,
   "bbox": {
    "x": 122.0,
    "y": 115.0,
    "width": 98.0,
    "height": 44.0
   },
   "group_id": "grp_fea877d4",
   "in_form": false,
   "form_id": null,
   "required": null,
   "disabled": false,
   "level": null,
   "options": null,
   "order": 8
  },
  {
   "id": "el_f31a6d95",
   "type": "link",
   "text": "出租网约",
   "label": null,
   "aria_label": null,
   "placeholder": null,
   "name": null,
   "value": null,
   "href": "https://demo.easyview.local/taxi",
   "selector": "nav > a:nth-of-type(3)",
   "xpath": "/html[1]/body[1]/nav[1]/a[3]",
   "visible": true,
   "bbox": {
    "x": 224.0,
    "y": 115.0,
    "width": 98.0,
    "height": 44.0
   },
   "group_id": "grp_fea877d4",
   "in_form": false,
   "form_id": null,
   "required": null,
   "disabled": false,
   "level": null,
   "options": null,
   "order": 9
  },
  {
   "id": "el_02acb258",
   "type": "link",
   "text": "ETC 服务",
   "label": null,
   "aria_label": null,
   "placeholder": null,
   "name": null,
   "value": null,
   "href": "https://demo.easyview.local/etc",
   "selector": "nav > a:nth-of-type(4)",
   "xpath": "/html[1]/body[1]/nav[1]/a[4]",
   "visible": true,
   "bbox": {
    "x": 326.0,
    "y": 115.0,
    "width": 99.0,
    "height": 44.0
   },
   "group_id": "grp_fea877d4",
   "in_form": false,
   "form_id": null,
   "required": null,
   "disabled": false,
   "level": null,
   "options": null,
   "order": 10
  },
  {
   "id": "el_678ef4c9",
   "type": "link",
   "text": "违章查询",
   "label": null,
   "aria_label": null,
   "placeholder": null,
   "name": null,
   "value": null,
   "href": "https://demo.easyview.local/violation",
   "selector": "nav > a:nth-of-type(5)",
   "xpath": "/html[1]/body[1]/nav[1]/a[5]",
   "visible": true,
   "bbox": {
    "x": 429.0,
    "y": 115.0,
    "width": 98.0,
    "height": 44.0
   },
   "group_id": "grp_fea877d4",
   "in_form": false,
   "form_id": null,
   "required": null,
   "disabled": false,
   "level": null,
   "options": null,
   "order": 11
  },
  {
   "id": "el_24f1a3f8",
   "type": "link",
   "text": "实时路况",
   "label": null,
   "aria_label": null,
   "placeholder": null,
   "name": null,
   "value": null,
   "href": "https://demo.easyview.local/road",
   "selector": "nav > a:nth-of-type(6)",
   "xpath": "/html[1]/body[1]/nav[1]/a[6]",
   "visible": true,
   "bbox": {
    "x": 531.0,
    "y": 115.0,
    "width": 98.0,
    "height": 44.0
   },
   "group_id": "grp_fea877d4",
   "in_form": false,
   "form_id": null,
   "required": null,
   "disabled": false,
   "level": null,
   "options": null,
   "order": 12
  },
  {
   "id": "el_c8dc41cb",
   "type": "link",
   "text": "证照办理",
   "label": null,
   "aria_label": null,
   "placeholder": null,
   "name": null,
   "value": null,
   "href": "https://demo.easyview.local/license",
   "selector": "nav > a:nth-of-type(7)",
   "xpath": "/html[1]/body[1]/nav[1]/a[7]",
   "visible": true,
   "bbox": {
    "x": 634.0,
    "y": 115.0,
    "width": 98.0,
    "height": 44.0
   },
   "group_id": "grp_fea877d4",
   "in_form": false,
   "form_id": null,
   "required": null,
   "disabled": false,
   "level": null,
   "options": null,
   "order": 13
  },
  {
   "id": "el_965ad090",
   "type": "heading",
   "text": "出行服务入口",
   "label": null,
   "aria_label": null,
   "placeholder": null,
   "name": null,
   "value": null,
   "href": null,
   "selector": "div:nth-of-type(1) > div:nth-of-type(1) > h3",
   "xpath": "/html[1]/body[1]/div[3]/div[1]/div[1]/h3[1]",
   "visible": true,
   "bbox": {
    "x": 21.0,
    "y": 214.0,
    "width": 1016.0,
    "height": 41.0
   },
   "group_id": null,
   "in_form": false,
   "form_id": null,
   "required": null,
   "disabled": false,
   "level": null,
   "options": null,
   "order": 14
  },
  {
   "id": "el_c663c1b2",
   "type": "link",
   "text": "公交线路查询",
   "label": null,
   "aria_label": null,
   "placeholder": null,
   "name": null,
   "value": null,
   "href": "https://demo.easyview.local/bus/query",
   "selector": "div:nth-of-type(3) > div:nth-of-type(1) > div:nth-of-type(1) > div > a:nth-of-type(1)",
   "xpath": "/html[1]/body[1]/div[3]/div[1]/div[1]/div[1]/a[1]",
   "visible": true,
   "bbox": {
    "x": 39.0,
    "y": 273.0,
    "width": 124.0,
    "height": 51.0
   },
   "group_id": null,
   "in_form": false,
   "form_id": null,
   "required": null,
   "disabled": false,
   "level": null,
   "options": null,
   "order": 15
  },
  {
   "id": "el_bfbcf48d",
   "type": "link",
   "text": "地铁线路图",
   "label": null,
   "aria_label": null,
   "placeholder": null,
   "name": null,
   "value": null,